{
  "title": "Readiness & Go-Live Gate Workflow",
  "subtitle": "Portfolio Governance ↔ Adoption Intelligence | INT-04",
  "footer": "Agent Ecosystem | PG Portal",
  "slug": "readiness-go-live-gate-workflow",
  "flow": [
    {
      "type": "start",
      "label": "Start"
    },
    {
      "type": "step",
      "id": "n1",
      "kind": "automated",
      "role": "1: AI",
      "title": "Readiness Assessment",
      "desc": [
        "AI-C2: Org readiness eval"
      ]
    },
    {
      "type": "step",
      "id": "n2",
      "kind": "integration",
      "role": "2: Event",
      "title": "Submit to PG",
      "desc": [
        "readiness.assessed event"
      ]
    },
    {
      "type": "step",
      "id": "n3",
      "kind": "manual",
      "role": "3: Governance",
      "title": "Gate Review",
      "desc": []
    },
    {
      "type": "step",
      "id": "n4",
      "kind": "automated",
      "role": "4: AI",
      "title": "Remediation",
      "desc": [
        "AI-C11: Interventions"
      ]
    },
    {
      "type": "decision",
      "id": "gate",
      "title": [
        "Go-live",
        "approved?"
      ],
      "yesLabel": "Yes",
      "noLabel": "No",
      "no": {
        "label": "Remediation required"
      }
    },
    {
      "type": "step",
      "id": "n5",
      "kind": "automated",
      "role": "5: AI",
      "title": "Hypercare",
      "desc": [
        "AI-C9: Go-live support"
      ]
    },
    {
      "type": "step",
      "id": "n6",
      "kind": "manual",
      "role": "6: Field",
      "title": "Live Support",
      "desc": [
        "Issue resolution"
      ]
    },
    {
      "type": "step",
      "id": "n7",
      "kind": "automated",
      "role": "7: AI",
      "title": "Collect Evidence",
      "desc": [
        "stabilization.complete"
      ]
    },
    {
      "type": "step",
      "id": "n8",
      "kind": "manual",
      "role": "8: Governance",
      "title": "Close Gate",
      "desc": [
        "Record completion"
      ]
    },
    {
      "type": "step",
      "id": "n9",
      "kind": "automated",
      "role": "9: PG",
      "title": "Benefits Track",
      "desc": [
        "PG-C8: Value link"
      ]
    },
    {
      "type": "end",
      "label": "Complete"
    }
  ],
  "cards": {
    "ioTable": [
      {
        "input": "Readiness assessments, test results, resource requirements",
        "output": "Readiness scores, critical gaps, risk assessments",
        "example": "Readiness assessments → Readiness scores",
        "meaning": "Raw readiness inputs are evaluated to produce scored readiness, with critical gaps and risks surfaced for the gate."
      },
      {
        "input": "Gap analysis, remediation plans, validation criteria",
        "output": "Gate approval status, go/no-go decision, risk approval",
        "example": "Gap analysis → Gate approval status",
        "meaning": "Gaps and remediation plans are checked against validation criteria to reach a go/no-go gate decision with risk sign-off."
      },
      {
        "input": "Go-live decision, deployment plans, rollback procedures",
        "output": "Live status, deployment completion, go-live confirmation",
        "example": "Go-live decision → Live status",
        "meaning": "The approved go-live decision drives deployment, yielding confirmed live status once cutover completes."
      }
    ]
  }
}