{
  "title": "Capability Data Flows: Complete Ecosystem",
  "subtitle": "How data moves through 27 capability agents | AI Sensing → PG Aggregation → Governance → Benefits",
  "footer": "Agent Ecosystem Documentation | Capability Data Flows",
  "slug": "capability-data-flows-complete-ecosystem",
  "flow": [
    {
      "type": "start",
      "label": "Start"
    },
    {
      "type": "step",
      "id": "n1",
      "kind": "automated",
      "role": "1: AI Layer",
      "title": "1. AI Sensing",
      "desc": [
        "13 AI capabilities produce data"
      ]
    },
    {
      "type": "step",
      "id": "n2",
      "kind": "automated",
      "role": "1a: AI",
      "title": "Adoption Metrics",
      "desc": [
        "AI-C10: Usage analytics"
      ]
    },
    {
      "type": "step",
      "id": "n3",
      "kind": "automated",
      "role": "1b: AI",
      "title": "Training Coverage",
      "desc": [
        "AI-C6/C7: Curriculum data"
      ]
    },
    {
      "type": "step",
      "id": "n4",
      "kind": "automated",
      "role": "1c: AI",
      "title": "Readiness Scores",
      "desc": [
        "AI-C2: Assessments"
      ]
    },
    {
      "type": "step",
      "id": "n5",
      "kind": "automated",
      "role": "1d: AI",
      "title": "Resistance Signals",
      "desc": [
        "AI-C3/C10/C11: Barriers"
      ]
    },
    {
      "type": "step",
      "id": "n6",
      "kind": "automated",
      "role": "1e: AI",
      "title": "Comms Effectiveness",
      "desc": [
        "AI-C4/C5: Resonance data"
      ]
    },
    {
      "type": "step",
      "id": "n7",
      "kind": "automated",
      "role": "1f: AI",
      "title": "Impact Assessment",
      "desc": [
        "AI-C12: Value leakage"
      ]
    },
    {
      "type": "step",
      "id": "n8",
      "kind": "automated",
      "role": "1g: AI",
      "title": "Hypercare Evidence",
      "desc": [
        "AI-C9: Stabilization"
      ]
    },
    {
      "type": "step",
      "id": "n9",
      "kind": "automated",
      "role": "2: PG Layer",
      "title": "2. PG Aggregation",
      "desc": [
        "14 PG capabilities consume"
      ]
    },
    {
      "type": "step",
      "id": "n10",
      "kind": "automated",
      "role": "2a: PG",
      "title": "Dashboard",
      "desc": [
        "PG-C1: Portfolio view"
      ]
    },
    {
      "type": "step",
      "id": "n11",
      "kind": "automated",
      "role": "2b: PG",
      "title": "Health Index",
      "desc": [
        "PG-C5: Leading indicators"
      ]
    },
    {
      "type": "step",
      "id": "n12",
      "kind": "automated",
      "role": "2c: PG",
      "title": "Benefits Tracking",
      "desc": [
        "PG-C8: Value realization"
      ]
    },
    {
      "type": "step",
      "id": "n13",
      "kind": "automated",
      "role": "2d: PG",
      "title": "Exec Reporting",
      "desc": [
        "PG-C11: KPI dashboards"
      ]
    },
    {
      "type": "step",
      "id": "n14",
      "kind": "automated",
      "role": "2e: PG",
      "title": "Comms Governance",
      "desc": [
        "PG-C7: Message QA"
      ]
    },
    {
      "type": "step",
      "id": "n15",
      "kind": "automated",
      "role": "2f: PG",
      "title": "Risk Register",
      "desc": [
        "PG-C10: Portfolio risks"
      ]
    },
    {
      "type": "step",
      "id": "n16",
      "kind": "automated",
      "role": "2g: PG",
      "title": "Readiness Gates",
      "desc": [
        "PG-C9: Go/no-go"
      ]
    },
    {
      "type": "step",
      "id": "n17",
      "kind": "manual",
      "role": "3: Governance",
      "title": "3. Governance",
      "desc": [
        "Board reviews, decides"
      ]
    },
    {
      "type": "step",
      "id": "n18",
      "kind": "manual",
      "role": "3a: Board",
      "title": "Gate Decisions",
      "desc": [
        "Go-live approval"
      ]
    },
    {
      "type": "step",
      "id": "n19",
      "kind": "manual",
      "role": "3b: Board",
      "title": "Escalation Approval",
      "desc": [
        "Fund interventions"
      ]
    },
    {
      "type": "step",
      "id": "n20",
      "kind": "manual",
      "role": "3c: Board",
      "title": "Strategy Adjustments",
      "desc": [
        "Pivot decisions"
      ]
    },
    {
      "type": "step",
      "id": "n21",
      "kind": "automated",
      "role": "4: AI Execution",
      "title": "4. AI Execution",
      "desc": [
        "AI acts on decisions"
      ]
    },
    {
      "type": "step",
      "id": "n22",
      "kind": "automated",
      "role": "4a: AI",
      "title": "Remediation",
      "desc": [
        "AI-C11: Interventions"
      ]
    },
    {
      "type": "step",
      "id": "n23",
      "kind": "automated",
      "role": "4b: AI",
      "title": "Hypercare Deploy",
      "desc": [
        "AI-C9: Go-live support"
      ]
    },
    {
      "type": "step",
      "id": "n24",
      "kind": "automated",
      "role": "4c: AI",
      "title": "Comms Execution",
      "desc": [
        "AI-C4: Campaign exec"
      ]
    },
    {
      "type": "step",
      "id": "n25",
      "kind": "automated",
      "role": "5: PG",
      "title": "5. Outcomes",
      "desc": [
        "Track benefits, value"
      ]
    },
    {
      "type": "step",
      "id": "n26",
      "kind": "automated",
      "role": "5a: PG",
      "title": "Value Realization",
      "desc": [
        "PG-C8: Adoption→Benefits"
      ]
    },
    {
      "type": "step",
      "id": "n27",
      "kind": "automated",
      "role": "5b: PG",
      "title": "Continuous Improve",
      "desc": [
        "PG-C12: Learnings"
      ]
    },
    {
      "type": "end",
      "label": "Complete"
    }
  ],
  "cards": {
    "ioTable": [
      {
        "input": "Usage telemetry, surveys, assessments, resistance signals",
        "output": "Adoption metrics, readiness scores, health index",
        "example": "Usage telemetry → Adoption metrics",
        "meaning": "Raw usage and sentiment signals are sensed and scored into adoption metrics, readiness scores, and a health index."
      },
      {
        "input": "Health index, benefit mapping, risk triaging data",
        "output": "Aggregated insights, readiness gates, escalation signals",
        "example": "Health index → Aggregated insights",
        "meaning": "Scored signals are aggregated into portfolio insights that trigger readiness gates and escalations."
      },
      {
        "input": "Gate decisions, remediation directives, resource allocations",
        "output": "AI execution tasks, comms campaigns, risk mitigation",
        "example": "Gate decisions → AI execution tasks",
        "meaning": "Governance decisions are translated into concrete AI execution tasks, comms campaigns, and risk mitigations."
      },
      {
        "input": "Adoption rates, benefits realized, ROI metrics, lessons learned",
        "output": "Value realization reports, strategy adjustments, continuous improvement",
        "example": "Adoption rates → Value realization reports",
        "meaning": "Realised outcomes are measured into value-realization reporting that feeds strategy adjustments and continuous improvement."
      }
    ]
  }
}