{
  "title": "Multiple Loops",
  "subtitle": "More than one loop corridor",
  "flow": [
    {
      "type": "start",
      "label": "Start"
    },
    {
      "type": "step",
      "id": "n1",
      "kind": "manual",
      "title": "Collect",
      "desc": [
        "Gather inputs"
      ]
    },
    {
      "type": "step",
      "id": "n2",
      "kind": "automated",
      "title": "Validate",
      "desc": [
        "Run checks"
      ]
    },
    {
      "type": "step",
      "id": "n3",
      "kind": "integration",
      "title": "Dispatch",
      "desc": [
        "Send onward"
      ]
    },
    {
      "type": "step",
      "id": "n4",
      "kind": "automated",
      "title": "Monitor",
      "desc": [
        "Observe"
      ]
    },
    {
      "type": "end",
      "label": "End"
    }
  ],
  "loops": [
    {
      "from": "n4",
      "to": "n2",
      "style": "cycle",
      "label": "drift detected"
    },
    {
      "from": "n3",
      "to": "n1",
      "style": "revision",
      "label": "resubmit"
    },
    {
      "from": "n2",
      "to": "n1",
      "style": "exception",
      "label": "validation failed"
    }
  ]
}